review_rating,review_body,Cleaned_Review
0,"Hello everyone,This travel makeup bag definitely surprised me with qualities I’m sure others would also appreciate. The color scheme is elegant, the faux smooth leather on top with contrasting texture on the bottom makes it look high end, well made, It’s waterproof, has a handle and most importantly although not big, you can fit quite a lot in it. I used it during a recent trip and was able to fit all the makeup, skin care and even hair ties I needed. While closed, it seems small, but once opened, it expands, has convenient “wall pockets”, two big compartments and a middle zipper. All my products were visible which facilitated me getting ready everydaysince I didn’t have to look through tons of products. My rating reflects the fact that it gets stained very easily and now post travel, I can’t remove the stains both in and out which makes it look worn and dirty.Thank you!",hello everyone travel makeup bag definitely surprised qualities sure others would also appreciate color scheme elegant faux smooth leather top contrasting texture bottom makes look high end well made waterproof handle importantly although big fit quite lot used recent trip able fit makeup skin care even hair ties needed closed seems small opened expands convenient wall pockets two big compartments middle zipper products visible facilitated getting ready everydaysince look tons products rating reflects fact gets stained easily post travel remove stains makes look worn dirty thank
1,"so i like to do my nails in front of the tv at night so i can hang out with my bf and i wanted a case i can carry everything in instead of making multiple trips back and forth bringing everything out to the living room, i was worried this would be too small to fit everything but it actually fit so much that i’m using it to store all my lash extension supplies too!! the divider in the middle makes it so convenient to divide between the two. i’m amazed this not only carries my nail polish and tools but even my nail polish remover bottle!! the way it folds up however keeps it from getting too bulky it is so so clever. it opens up to fold flat and give you so much space but then when zipped shut it’s somehow half the size. it fits perfectly under my vanity shelf so i can quickly grab everything i need. plus the design is so so cute and i love the gold hardware!!! so minimal but classy and feminine. unbeatable and it feels durable and tough. buy it now!!!! great for travel also!",like nails front night hang wanted case carry everything instead making multiple trips back forth bringing everything living room worried would small fit everything actually fit much using store lash extension supplies divider middle makes convenient divide two amazed carries nail polish tools even nail polish remover bottle way folds however keeps getting bulky clever opens fold flat give much space zipped shut somehow half size fits perfectly vanity shelf quickly grab everything need plus design cute love gold hardware minimal classy feminine unbeatable feels durable tough buy great travel also
0,BOTTOM LINE:1. I recommend this KAT MYHR travel bag.2. The current price of $20 is reasonable.3. I don't have makeup. I'm using it for toiletries. Working well.LIKES:- Lots of places to hold my supplies without falling all over the place.- Opens up to easily access everything. Better than my old typical bag.DISLIKES:- Can't open is slightly to grab something. Have to open it all the way to access stuff.,bottom line recommend kat travel bag current price reasonable makeup using toiletries working well likes lots places hold supplies without falling place opens easily access everything better old typical bag dislikes open slightly grab something open way access stuff
1,"It seems that popularity across multiple age groups of our youth is being guided by the suggestions of infamous YouTubers and Tik Tokers that carry with them the multitudes of our listening youth.Well as for me, I am not subscribed to this social media venues, however my kids, or should I say young adults are. With that stated, when I found this Large Capacity Traveling Cosmetic Bag, I was educated on what people are gravitating to, through my daughters eek's and screams of joy when I gave her this case.She said that she had just recently seen one of these on one her social media educational videos that was discussing how to travel efficiently. She grabbed it, and immediately ran to her room to try to put her travel necessities together in it, in preparation for a weekender excursion with a group of her friends.She seemed to easily pack in all of the items she would need for her trip rather quickly, and came back out to the living room to display her efficiently packed essentials. With great amazement, I looked on as she told me just how the bag was supposed to be used to separate her bath and beauty itemsin a neat foldout containment bag.Well she went on her trip, and returned to boast of how her friends were so amazed to see and appreciate all of the hoopla surrounding these nifty personal hygiene foldout sacks, that hold every essential item you'll need for that well deserved get away.She said as I had already known, that these bags are well worth every penny spent on them, simply for the consolidated convenience of having everything you'll need neatly tucked in place in a singular awesomely crafted beauty bag.",seems popularity across multiple age groups youth guided suggestions infamous youtubers tie towers carry multitudes listening youth well subscribed social media venues however kids say young adults stated found large capacity traveling cosmetic bag educated people gravitating daughters eek screams joy gave case said recently seen one one social media educational videos discussing travel efficiently grabbed immediately ran room try put travel necessities together preparation weekender excursion group friends seemed easily pack items would need trip rather quickly came back living room display efficiently packed essentials great amazement looked told bag supposed used separate bath beauty items neat foldout containment bag well went trip returned boast friends amazed see appreciate hoopla surrounding nifty personal hygiene foldout sacks hold every essential item need well deserved get away said already known bags well worth every penny spent simply consolidated convenience everything need neatly tucked place singular awesomely crafted beauty bag
1,Bought this for my niece as she loved it. Arrived quickly and at a good price. Highly recommend,bought niece loved arrived quickly good price highly recommend
1,This is a very nice looking makeup bag. I love the color and the mixed materials it is made of. Part of it feels like canvas and the other part the PU leather. The zipper works great and does not catch. The inside liner is very nice as well. The flaps on the end are long enough to keep your makeup from falling out. There is a zipper pouch in the middle that can separate the bag as well as hold other products.,nice looking makeup bag love color mixed materials made part feels like canvas part leather zipper works great catch inside liner nice well flaps end long enough keep makeup falling zipper pouch middle separate bag well hold products
1,The design of this bag was so well done. I love that this bag makes it easy to separate me and my husband's basic toiletries. I like that since the zipper is on the corner the bag lays in a way that easily displays the inside of the bag. I also like that it has side pockets to further organize each side. I like that it's still small and won't take up massive space in our luggage. One thing I did think was funny is that one side of the bag doesn't match the material on the rest of the bag. Now that I see this it does show in the preview pictures for the product. This doesn't matter to me but it might to some.,design bag well done love bag makes easy separate husband basic toiletries like since zipper corner bag lays way easily displays inside bag also like side pockets organize side like still small take massive space luggage one thing think funny one side bag match material rest bag see show preview pictures product matter might
1,"This bag extends and creates a lot of room to store whatever you need. It also has side pockets along both sides to store more products. The material is good and sturdy, it will last you a long time. It is light weight and easy to carry everywhere you go.",bag extends creates lot room store whatever need also side pockets along sides store products material good sturdy last long time light weight easy carry everywhere go
1,"The size is perfect for all her makeup. She absolutely loves the color. The quality is good, and the zipper is easy to use. Also very easy to clean.",size perfect makeup absolutely loves color quality good zipper easy use also easy clean
1,This is a nice large makeup/travel bag. It fits so much inside. Nice looking and made of good material. Has extra pockets inside to separate utensils and other stuff from the makeup itself. It has enough room in it to put other toiletries in it. I would have liked the material to be soft but that doesn’t take away any stars.,nice large makeup travel bag fits much inside nice looking made good material extra pockets inside separate utensils stuff makeup enough room put toiletries would liked material soft take away stars
1,"She loves that it opens wide and flattens, holds everything she needs separatelyand easy to carry.",loves opens wide flattens holds everything needs separatelyand easy carry
1,"Very nice outside waterproof texture to this cosmetic bag. Perfect size! Has one large elastic compartment on one side, one zippered compartment in the middle. Also two elastic compartments on the opposite side. Bag is waterproof and the zipper is well-made. The zipper is a beautiful, soft gold color amd the handle is very well-made also. Nice size to keep cosmetics and brushes in. Very nice gift and excellent price for the quality.",nice outside waterproof texture cosmetic bag perfect size one large elastic compartment one side one zippered compartment middle also two elastic compartments opposite side bag waterproof zipper well made zipper beautiful soft gold color handle well made also nice size keep cosmetics brushes nice gift excellent price quality
1,"If you travel a lot, you likely can make use of a good quality travel bag.Look no further.This is a good cosmetic bag. Looks good on the outside and the inside.It's intended for women's use and would make a fine gift. It can also be used for other purposes in travel.Highly recommended!",travel lot likely make use good quality travel bag look good cosmetic bag looks good outside inside intended women use would make fine gift also used purposes travel highly recommended
1,"Contrasting color zipper adds to nice appearance yet is easy/normal to use. When it opens bag sits flat so you can get anything in and out easily. Center divider is actually a zipper pocket, which is nice for extra things especially small things. Nice internal side pockets with elastic to get into the sides easier, I like this feature. Strong outer material, very well made, strong stitching to hold up for a long time. Really like this because other make-up bags are a little smaller and my long make-up sticks never fit. This one is great!",contrasting color zipper adds nice appearance yet easy normal use opens bag sits flat get anything easily center divider actually zipper pocket nice extra things especially small things nice internal side pockets elastic get sides easier like feature strong outer material well made strong stitching hold long time really like make bags little smaller long make sticks never fit one great
